Bureau Number,Employer Name,Street Address,City,State,Zip Code,Insurer Name,LookupStatus
27,"CHALLENGE DAIRY PRODUCTS, INC.",1241 NORTH KELSEY STREET,VISALIA,CA,93291,Zurich American Insurance Company,
27,"CHALLENGE DAIRY PRODUCTS, INC.",2000 NORTH PLAZA DRIVE,VISALIA,CA,93291,Zurich American Insurance Company,
27,"CHALLENGE DAIRY PRODUCTS, INC.",2000 NORTH PLAZA DRIVE,VISALIA,CA,932919358,Zurich American Insurance Company,
27,"CHALLENGE DAIRY PRODUCTS, INC.","791, 801, AND 811 NORTH KELSEY STREET",VISALIA,CA,93291,Zurich American Insurance Company,
27,"CHALLENGE DAIRY PRODUCTS, INC.",8000 WEST DOE AVENUE,VISALIA,CA,932917989,Zurich American Insurance Company,
27,"CHALLENGE DAIRY PRODUCTS, INC.",8020 WEST DOE AVENUE,VISALIA,CA,932919701,Zurich American Insurance Company,
1252,"CENTRAL COAST COOLING, LLC.",PO BOX 1170,SALINAS,CA,939021170,Pacific Compensation Insurance Company,
1252,CENTRAL COAST ENGINEERS INC,P O BOX 2503,SALINAS,CA,939020000,Travelers Property Casualty Company of America,
1901,"LIQUINOX COMPANY, INC.",221 WEST MEATS AVENUE,ORANGE,CA,92865,Preferred Employers Insurance Company,
1901,"LIQUINOX COMPANY, INC.",C/ O BRANNON GARNER 221 WEST MEATS AVENUE,ORANGE,CA,92865,Preferred Employers Insurance Company,
2581,,,,,,,No results found
2979,CUMMINS GENERATOR TECHNOLOGIES AMERICAS INC.,500 JACKSON STREET,COLUMBUS,IN,47201,Old Republic Insurance Company,
2979,CUMMINS POWER GENERATION INC.,500 JACKSON STREET,COLUMBUS,IN,47201,Old Republic Insurance Company,
4742,"GLAXOSMITHKLINE, LLC",410 AND 406 BLACKWELL STREET FOWLER AND CROWE BUILDING,DURHAM,NC,27701,Old Republic Insurance Company,
5275,"GARRATT-CALLAHAN COMPANY, INC. (CORPORATION)",50 INGOLD RD,BURLINGAME,CA,94010,Zenith Insurance Company,
5275,"GARRATT-CALLAHAN COMPANY, INC. (CORPORATION)","ATTN: MR. MATT COLVIN, CFO 50 INGOLD RD",BURLINGAME,CA,94010,Zenith Insurance Company,
6260,SARATOGA FEDERATED CHURCH,20390 PARK PL,SARATOGA,CA,95070,Brotherhood Mutual Insurance Company,
6755,BAYSHIRE CENTRAL VALLEY LLC,717 S WINERY,FRESNO,CA,93727,StarStone National Insurance Company,
6755,"CENTRAL VALLEY ASSEMBLY & PACKAGING, INC. (CORPORATION)",5515 E LAMONA AVE,FRESNO,CA,93727,Zenith Insurance Company,
6755,"CENTRAL VALLEY ASSEMBLY & PACKAGING, INC. (CORPORATION)","5515 E LAMONA AVE, SUITE STE 103",FRESNO,CA,93727,Zenith Insurance Company,
6755,"CENTRAL VALLEY ASSEMBLY & PACKAGING, INC. (CORPORATION)","5515 E LAMONA AVE, SUITE STE 108",FRESNO,CA,93727,Zenith Insurance Company,
6755,CENTRAL VALLEY CARE INC,2224 N FINE AVE SUITE 101,FRESNO,CA,93727,Insurance Company of the West,
6755,CENTRAL VALLEY CARE INC,"2224 N FINE AVE, STE 101",FRESNO,CA,93727,Insurance Company of the West,
6755,CENTRAL VALLEY CHILDREN'S SERVICES NETWORK (NOT FOR PROFIT),1911 N HELM AVE.,FRESNO,CA,93727,Security National Insurance Company,
6755,CENTRAL VALLEY CONNECT,5867 E INYO ST,FRESNO,CA,93727,State Compensation Insurance Fund,
6755,CENTRAL VALLEY CONNECT DBA,5867 E INYO ST,FRESNO,CA,93727,State Compensation Insurance Fund,
6755,"CENTRAL VALLEY CONTRACTING SPECIALISTS, INC.DBA CENTRAL VALLEY RAIN GUTTERS",3970 N ANN AVE,FRESNO,CA,93727,ACE American Insurance Company,
6755,CENTRAL VALLEY DRYWALL (DBA),5790 E SHIELDS,FRESNO,CA,93727,Insurance Company of the West,
6755,CENTRAL VALLEY DRYWALL (DBA),5790 E SHIELDS UNIT# 102,FRESNO,CA,93727,Insurance Company of the West,
6755,CENTRAL VALLEY GLASS INC,5530 E LAMONA AVE,FRESNO,CA,937272277,Markel Insurance Company,
6755,CENTRAL VALLEY HEALTH NETWORK INC,1967 N GTWY,FRESNO,CA,937271639,Hartford Casualty Insurance Company,
6755,CENTRAL VALLEY HVAC SOLUTIONS LLC,5356 E ATCHISON ST,FRESNO,CA,93727,Security National Insurance Company,
6755,CENTRAL VALLEY IMMIGRANT INTEG,5014 EAST UNIVERSITY AVE,FRESNO,CA,937271660,Employers Preferred Insurance Company,
6755,CENTRAL VALLEY IMMIGRANT INTEG,5014 EAST UNIVERSITY AVENUE STE 101,FRESNO,CA,937271661,Employers Preferred Insurance Company,
6755,CENTRAL VALLEY LABELS INC,6373 E. TURNER AVE.,FRESNO,CA,93727,Insurance Company of the West,
6755,CENTRAL VALLEY LABELS INC,6373 EAST TURNER AVE,FRESNO,CA,93727,Insurance Company of the West,
6755,CENTRAL VALLEY MACHINING INC.,5820 E HARVARD AVE,FRESNO,CA,93727,ProCentury Insurance Company,
6755,"CENTRAL VALLEY OVERHEAD DOOR, INC.",2664 N. BUSINESS PARK AVENUE,FRESNO,CA,93727,Security National Insurance Company,
6755,"CENTRAL VALLEY R.V. REPAIR, LLC",5349 EAST HOME,FRESNO,CA,93727,Midwest Insurance Company,
6755,"CENTRAL VALLEY ROOFERS, WATERPROOFERS & ALLIED WORKERS",5537 E LAMONA AVE # 1,FRESNO,CA,93727,Hartford Casualty Insurance Company,
6755,"CENTRAL VALLEY ROOFERS, WATERPROOFERS & ALLIED WORKERS",5537 E LAMONA AVE # 1,FRESNO,CA,937272226,Hartford Casualty Insurance Company,
6755,CENTRAL VALLEY RV REPAIR (DBA),5349 EAST HOME,FRESNO,CA,93727,Midwest Insurance Company,
6755,CENTRAL VALLEY SHELVING (DBA),2577 S MIAMI AVE,FRESNO,CA,93727,Clear Spring Property and Casualty Company,
6755,CENTRAL VALLEY SPORTS STITCH &,5856 E BROWN AVE,FRESNO,CA,937271362,Employers Preferred Insurance Company,
6755,CENTRAL VALLEY SPORTS STITCH &,5856 EAST BROWN AVENUE,FRESNO,CA,93727,Employers Preferred Insurance Company,
6755,"CENTRAL VALLEY TRAINING CENTER, INC.",4018 N ANN AVE,FRESNO,CA,937277448,CompWest Insurance Company,
6755,"LCF CENTRAL VALLEY CONTRACTING SPECIALISTS, INC.",3970 N ANN AVE,FRESNO,CA,93727,ACE American Insurance Company,
6755,"MY CENTRAL VALLEY, LLC",4974 E. CLINTON WAY BLDG A 2ND FL,FRESNO,CA,93727,Hartford Casualty Insurance Company,
6755,OHANA CARE HOME CENTRAL VALLEY LLC,6952 E ANDREWS AVE,FRESNO,CA,93727,"Technology Insurance Company, Inc.",
7875,ABEN MACHINE PRODUCTS INC,9550 OWENSMOUTH AVE,CHATSWORTH,CA,913114801,Middlesex Insurance Company,